{
  "id": "echo-developer-studio",
  "kind": "studio",
  "version": "0.1.0",
  "channel": "alpha",
  "publisher": "knoxhack",
  "sourceRepo": "knoxhack/ECHO-Developer-Studio",
  "releaseTag": "v0.1.0",
  "commitSha": "79ac5c99ac8d954e2a56ab7c70072e9cd27ce5f3",
  "artifacts": {
    "windowsPortable": {
      "file": "ECHO-Developer-Studio-0.1.0-Portable.exe",
      "url": "https://github.com/knoxhack/ECHO-Developer-Studio/releases/download/v0.1.0/ECHO-Developer-Studio-0.1.0-Portable.exe",
      "sha256": "132496b38a23f34790d1572dd9ef6fa7aa987bdbc386594855b88731d12cfe3c",
      "size": 106211984
    },
    "windowsSetup": {
      "file": "ECHO-Developer-Studio-0.1.0-Setup.exe",
      "url": "https://github.com/knoxhack/ECHO-Developer-Studio/releases/download/v0.1.0/ECHO-Developer-Studio-0.1.0-Setup.exe",
      "sha256": "3f2ea9b5d2f37fdfa90b67da353db0b10be4a14b5af5aad75dbc45d5d3902bbf",
      "size": 106655757
    },
    "windowsSetupBlockmap": {
      "file": "ECHO-Developer-Studio-0.1.0-Setup.exe.blockmap",
      "url": "https://github.com/knoxhack/ECHO-Developer-Studio/releases/download/v0.1.0/ECHO-Developer-Studio-0.1.0-Setup.exe.blockmap",
      "sha256": "1fdf21a084ee9e38e719bcc918e3060a5427280a952b13b2d326e5aa84b5a155",
      "size": 113680
    },
    "windowsArchive": {
      "file": "ECHO-Developer-Studio-0.1.0-win-x64.zip",
      "url": "https://github.com/knoxhack/ECHO-Developer-Studio/releases/download/v0.1.0/ECHO-Developer-Studio-0.1.0-win-x64.zip",
      "sha256": "75bac5428345ebffe583cae44531bc59ed7c57e0bf7023862dc1547152050272",
      "size": 150414082
    },
    "windowsExecutable": {
      "file": "ECHODeveloperStudio.exe",
      "url": "https://github.com/knoxhack/ECHO-Developer-Studio/releases/download/v0.1.0/ECHODeveloperStudio.exe",
      "sha256": "5c30e2036fbd1aeed1d323822aae2fccb996850610d84151d55fad2152b525ec",
      "size": 231522816
    },
    "helperElevate": {
      "file": "elevate.exe",
      "url": "https://github.com/knoxhack/ECHO-Developer-Studio/releases/download/v0.1.0/elevate.exe",
      "sha256": "9b1fbf0c11c520ae714af8aa9af12cfd48503eedecd7398d8992ee94d1b4dc37",
      "size": 107520
    },
    "latestYml": {
      "file": "latest.yml",
      "url": "https://github.com/knoxhack/ECHO-Developer-Studio/releases/download/v0.1.0/latest.yml",
      "sha256": "588a74a3a3cb4b64dff3fd91b4c4ef873920c025ea69ebb2575225bd8e53424b",
      "size": 371
    },
    "licenseElectron": {
      "file": "LICENSE.electron.txt",
      "url": "https://github.com/knoxhack/ECHO-Developer-Studio/releases/download/v0.1.0/LICENSE.electron.txt",
      "sha256": "5154e165bd6c2cc0cfbcd8916498c7abab0497923bafcd5cb07673fe8480087d",
      "size": 1096
    }
  },
  "dependencies": [],
  "compatibility": [
    "windows-x64"
  ],
  "trust": "source-linked",
  "validation": "approved"
}
