{
  "id": "echo-launcher",
  "kind": "product",
  "version": "1.1.9",
  "channel": "alpha",
  "publisher": "knoxhack",
  "sourceRepo": "knoxhack/ECHO-Launcher",
  "releaseTag": "v1.1.9",
  "commitSha": "1efb6978ac2cc945ec83705410dda4c0f3a61e35",
  "artifacts": {
    "windowsSetup": {
      "file": "ECHO-Launcher-1.1.9-Setup.exe",
      "url": "https://github.com/knoxhack/ECHO-Launcher/releases/download/v1.1.9/ECHO-Launcher-1.1.9-Setup.exe",
      "sha256": "934fd935a913f7fc3319e8fcf36a9504eb7209e47e7ebd6bef6e8af4966103e6",
      "size": 180874676
    },
    "windowsSetupBlockmap": {
      "file": "ECHO-Launcher-1.1.9-Setup.exe.blockmap",
      "url": "https://github.com/knoxhack/ECHO-Launcher/releases/download/v1.1.9/ECHO-Launcher-1.1.9-Setup.exe.blockmap",
      "sha256": "43589f07190bc2709baa503378fecf34ed091311678e2cb1ab0f9d76f2624ce7",
      "size": 174363
    },
    "latestYml": {
      "file": "latest.yml",
      "url": "https://github.com/knoxhack/ECHO-Launcher/releases/download/v1.1.9/latest.yml",
      "sha256": "c7e540b069468cb637e4dad932c2789e97902264249a12a2aba50cefab720af9",
      "size": 355
    }
  },
  "dependencies": [],
  "compatibility": [
    "windows-x64"
  ],
  "trust": "source-linked",
  "validation": "approved"
}
