{
  "id": "echo-addons-studio",
  "kind": "studio",
  "version": "0.1.0",
  "channel": "alpha",
  "publisher": "knoxhack",
  "sourceRepo": "knoxhack/ECHO-Addons-Studio",
  "releaseTag": "v0.1.0",
  "commitSha": "33cf84d15e5f90ee0caeea327532377b951d798a",
  "artifacts": {
    "windowsPortable": {
      "file": "ECHO.Addon.Studio-Portable-0.1.0.exe",
      "url": "https://github.com/knoxhack/ECHO-Addons-Studio/releases/download/v0.1.0/ECHO.Addon.Studio-Portable-0.1.0.exe",
      "sha256": "87ad00a2648d336ba673e1ffe02da5e5590dda9f8d6946d01412daafa72861eb",
      "size": 102776740
    },
    "windowsSetup": {
      "file": "ECHO.Addon.Studio-Setup-0.1.0.exe",
      "url": "https://github.com/knoxhack/ECHO-Addons-Studio/releases/download/v0.1.0/ECHO.Addon.Studio-Setup-0.1.0.exe",
      "sha256": "d0375fab83e85ce594f909f6be839ab8919bdd5504f29f29fcbdd59c0839c230",
      "size": 103023749
    },
    "windowsSetupBlockmap": {
      "file": "ECHO.Addon.Studio-Setup-0.1.0.exe.blockmap",
      "url": "https://github.com/knoxhack/ECHO-Addons-Studio/releases/download/v0.1.0/ECHO.Addon.Studio-Setup-0.1.0.exe.blockmap",
      "sha256": "b8989dd8e0b70c24ded9ef668f250c052e96647f5eee6dea92a4714e07b6a879",
      "size": 109653
    },
    "windowsExecutable": {
      "file": "ECHO.Addon.Studio.exe",
      "url": "https://github.com/knoxhack/ECHO-Addons-Studio/releases/download/v0.1.0/ECHO.Addon.Studio.exe",
      "sha256": "e0ec0196b284f2c41ab4fa893f65be83c40ba0688283bf504bf14d4742fc0efe",
      "size": 231748096
    },
    "helperElevate": {
      "file": "elevate.exe",
      "url": "https://github.com/knoxhack/ECHO-Addons-Studio/releases/download/v0.1.0/elevate.exe",
      "sha256": "9b1fbf0c11c520ae714af8aa9af12cfd48503eedecd7398d8992ee94d1b4dc37",
      "size": 107520
    },
    "latestYml": {
      "file": "latest.yml",
      "url": "https://github.com/knoxhack/ECHO-Addons-Studio/releases/download/v0.1.0/latest.yml",
      "sha256": "1c4dd27a6e94ff02a2aa1e48a5ed905b6acacc060a4f6886f98b8fd338931987",
      "size": 363
    },
    "licenseElectron": {
      "file": "LICENSE.electron.txt",
      "url": "https://github.com/knoxhack/ECHO-Addons-Studio/releases/download/v0.1.0/LICENSE.electron.txt",
      "sha256": "5154e165bd6c2cc0cfbcd8916498c7abab0497923bafcd5cb07673fe8480087d",
      "size": 1096
    }
  },
  "dependencies": [],
  "compatibility": [
    "windows-x64"
  ],
  "trust": "source-linked",
  "validation": "warning"
}
