{
  "channel": "beta",
  "publisher": "knoxhack",
  "sourceRepo": "knoxhack/ECHO-Arcana-Division-NeoForge-Edition",
  "releaseTag": "arcana-division-neoforge-1.0.0-beta",
  "commitSha": "fed14316de1f5290848cf99c6f95052580aa0fcd",
  "trust": "source-linked",
  "validation": "approved",
  "id": "echo-arcana-division-neoforge-edition",
  "kind": "product",
  "version": "1.0.0",
  "artifacts": {
    "archive": {
      "file": "arcana-division-neoforge-edition-1.0.0.zip",
      "url": "https://github.com/knoxhack/ECHO-Arcana-Division-NeoForge-Edition/releases/download/arcana-division-neoforge-1.0.0-beta/arcana-division-neoforge-edition-1.0.0.zip",
      "sha256": "0b93df35140263d5631657052b6c03a2a82cd584d5abc891b607a4a63dd45ec8",
      "size": 116853498
    },
    "arcanaDivisionNeoforgeEditionBeta100Pack": {
      "file": "arcana-division-neoforge-edition-beta-1.0.0.pack.json",
      "url": "https://github.com/knoxhack/ECHO-Arcana-Division-NeoForge-Edition/releases/download/arcana-division-neoforge-1.0.0-beta/arcana-division-neoforge-edition-beta-1.0.0.pack.json",
      "sha256": "629dfcc24dfdcdec6e305f3d7e98dea82cdb997391b0623a5f59711c9ee6eee5",
      "size": 53211
    },
    "checksums": {
      "file": "checksums.txt",
      "url": "https://github.com/knoxhack/ECHO-Arcana-Division-NeoForge-Edition/releases/download/arcana-division-neoforge-1.0.0-beta/checksums.txt",
      "sha256": "36def64ff6fd1205350bc1ddeaeafd326bef6d1dff45f32135ab78027f179ba2",
      "size": 313
    },
    "echoRelease": {
      "file": "echo-release.json",
      "url": "https://github.com/knoxhack/ECHO-Arcana-Division-NeoForge-Edition/releases/download/arcana-division-neoforge-1.0.0-beta/echo-release.json",
      "sha256": "460276742d5c0879ecfe96fe233af1c3eaa57ca1d0701c6f9578133400939104",
      "size": 11646
    },
    "releaseAudit": {
      "file": "release-audit.json",
      "url": "https://github.com/knoxhack/ECHO-Arcana-Division-NeoForge-Edition/releases/download/arcana-division-neoforge-1.0.0-beta/release-audit.json",
      "sha256": "0bf9b1f7ecaa6b15a31be1c55c70d39ddbd7cd05dbaf7b3a108194b0a55a3d8a",
      "size": 17759
    }
  },
  "dependencies": [],
  "compatibility": []
}
